pmid,title,primary_entity_short,matched_categories,pattern_count
29186950,Descriptor Data Bank (DDB): A Cloud Platform for Multiperspective Modeling of Protein-Ligand Interactions.,ddb,"workflow_pipeline, computational_ml",2
28275836,[se-atlas - the health service information platform for people with rare diseases : Supporting research on medical care institutions and support groups].,,"workflow_pipeline, using_phrases",2
26564970,pubmed.mineR: an R package with text-mining algorithms to analyse PubMed abstracts.,,"workflow_pipeline, using_phrases",2
27187206,SoFIA: a data integration framework for annotating high-throughput datasets.,sofia,"workflow_pipeline, data_integration",2
33751366,TRIPODD: a Novel Fluorescence Imaging Platform for In Situ Quantification of Drug Distribution and Therapeutic Response.,tripodd,"workflow_pipeline, using_phrases",2
34279599,AVPIden: a new scheme for identification and functional prediction of antiviral peptides based on machine learning approaches.,,"computational_ml, using_phrases",2
23735058,AllerTOP--a server for in silico prediction of allergens.,,"computational_ml, using_phrases",2
23671333,IgBLAST: an immunoglobulin variable domain sequence analysis tool.,,"workflow_pipeline, comparison_benchmark",2
23256920,"CpGAVAS, an integrated web server for the annotation, visualization, analysis, and GenBank submission of completely sequenced chloroplast genome sequences.",cpgavas,"comparison_benchmark, data_integration",2
31368353,OSkirc: a web tool for identifying prognostic biomarkers in kidney renal clear cell carcinoma.,oskirc,"workflow_pipeline, using_phrases",2
22693220,"CellBase, a comprehensive collection of RESTful web services for retrieving relevant biological information from heterogeneous sources.",,"data_integration, using_phrases",2
33110420,MDACP: A Pathogen Genome and Metagenome Analysis Cloud Platform.,mdacp,"workflow_pipeline, comparison_benchmark",2
29678128,SpirPep: an in silico digestion-based platform to assist bioactive peptides discovery from a genome-wide database.,,"workflow_pipeline, using_phrases",2
25150822,LRRsearch: An asynchronous server-based application for the prediction of leucine-rich repeat motifs and an integrative database of NOD-like receptors.,,"computational_ml, validation_study",2
32503412,PS4DR: a multimodal workflow for identification and prioritization of drugs based on pathway signatures.,ps4dr,"workflow_pipeline, using_phrases",2
28929973,Vermont: a multi-perspective visual interactive platform for mutational analysis.,vermont,"workflow_pipeline, comparison_benchmark",2
25797062,PTGBase: an integrated database to study tandem duplicated genes in plants.,,"data_integration, using_phrases",2
33208742,"QM-symex, update of the QM-sym database with excited state information for 173 kilo molecules.",,"using_phrases, database_update",2
23327649,Kerfuffle: a web tool for multi-species gene colocalization analysis.,,"workflow_pipeline, comparison_benchmark",2
34037702,SimText: a text mining framework for interactive analysis and visualization of similarities among biomedical entities.,,"workflow_pipeline, comparison_benchmark",2
32616517,LEMMI: a continuous benchmarking platform for metagenomics classifiers.,lemmi,"workflow_pipeline, comparison_benchmark",2
22125388,HGT-Gen: a tool for generating a phylogenetic tree with horizontal gene transfer.,,"workflow_pipeline, using_phrases",2
26133872,ChiMS: Open-source instrument control software platform on LabVIEW for imaging/depth profiling mass spectrometers.,chims,"workflow_pipeline, using_phrases",2
27131357,"PHYLOViZ Online: web-based tool for visualization, phylogenetic inference, analysis and sharing of minimum spanning trees.",,"workflow_pipeline, comparison_benchmark",2
26357328,RBioCloud: A Light-Weight Framework for Bioconductor and R-based Jobs on the Cloud.,,"workflow_pipeline, using_phrases",2
22952662,TARGETgene: a tool for identification of potential therapeutic targets in cancer.,,"workflow_pipeline, using_phrases",2
28212856,"ProBiS tools (algorithm, database, and web servers) for predicting and modeling of biologically interesting proteins.",probis,"workflow_pipeline, computational_ml",2
33028193,MSpectraAI: a powerful platform for deciphering proteome profiling of multi-tumor mass spectrometry data by using deep neural networks.,,"workflow_pipeline, using_phrases",2
25009129,StemSearch: RNA search tool based on stem identification and indexing.,,"workflow_pipeline, using_phrases",2
22616108,ApiNATOMY: a novel toolkit for visualizing multiscale anatomy schematics with phenotype-related information.,,"workflow_pipeline, using_phrases",2
28619054,HGPEC: a Cytoscape app for prediction of novel disease-gene and disease-disease associations and evidence collection based on a random walk on heterogeneous network.,hgpec,"computational_ml, using_phrases",2
23797110,FijiWings: an open source toolkit for semiautomated morphometric analysis of insect wings.,,"workflow_pipeline, comparison_benchmark",2
32320656,CytoMAP: A Spatial Analysis Toolbox Reveals Features of Myeloid Cell Organization in Lymphoid Tissues.,,"comparison_benchmark, using_phrases",2
26447887,TRANSIT--A Software Tool for Himar1 TnSeq Analysis.,transit,"workflow_pipeline, comparison_benchmark",2
25062914,tmBioC: improving interoperability of text-mining tools with BioC.,tmbioc,"workflow_pipeline, using_phrases",2
27846806,GEN3VA: aggregation and analysis of gene expression signatures from related studies.,gen3va,"comparison_benchmark, using_phrases",2
29504895,FunGeneNet: a web tool to estimate enrichment of functional interactions in experimental gene sets.,,"workflow_pipeline, using_phrases",2
26069265,Change-O: a toolkit for analyzing large-scale B cell immunoglobulin repertoire sequencing data.,,"workflow_pipeline, comparison_benchmark",2
32145577,Development and application of the thermodynamic database PRODATA dedicated to the monitoring of mining activities from exploration to remediation.,prodata,"using_phrases, validation_study",2
22373396,Populous: a tool for building OWL ontologies from templates.,,"workflow_pipeline, using_phrases",2
24838562,ProTox: a web server for the in silico prediction of rodent oral toxicity.,protox,"computational_ml, using_phrases",2
25496383,CompPhy: a web-based collaborative platform for comparing phylogenies.,,"workflow_pipeline, comparison_benchmark",2
25632109,"PhenoMiner: a quantitative phenotype database for the laboratory rat, Rattus norvegicus. Application in hypertension and renal disease.",,"using_phrases, validation_study",2
26739209,SuccinSite: a computational tool for the prediction of protein succinylation sites by exploiting the amino acid patterns and properties.,,"workflow_pipeline, computational_ml",2
27513885,Defining and Detecting Complex Peak Relationships in Mass Spectral Data: The Mz.unity Algorithm.,,"computational_ml, using_phrases",2
30587115,ACES: a machine learning toolbox for clustering analysis and visualization.,aces,"comparison_benchmark, computational_ml",2
22486148,Design and implementation of a web directory for medical education (WDME): a tool to facilitate research in medical education.,wdme,"workflow_pipeline, using_phrases",2
28578698,dictyExpress: a web-based platform for sequence data management and analytics in Dictyostelium and beyond.,,"workflow_pipeline, using_phrases",2
32215567,CRiSP: accurate structure prediction of disulfide-rich peptides with cystine-specific sequence alignment and machine learning.,crisp,"computational_ml, using_phrases",2
28824589,Fast and Simple Analysis of MiSeq Amplicon Sequencing Data with MetaAmp.,,"comparison_benchmark, using_phrases",2
32717064,Transcriptor: a comprehensive platform for annotation of the enzymatic functions of transcripts.,,"workflow_pipeline, data_integration",2
24894505,SMaSH: a benchmarking toolkit for human genome variant calling.,smash,"workflow_pipeline, comparison_benchmark",2
32735679,Planet Microbe: a platform for marine microbiology to discover and analyze interconnected 'omics and environmental data.,,"workflow_pipeline, comparison_benchmark",2
31804670,ImPLoc: a multi-instance deep learning model for the prediction of protein subcellular localization based on immunohistochemistry images.,imploc,"computational_ml, using_phrases",2
25938432,Tn-seq explorer: a tool for analysis of high-throughput sequencing data of transposon mutant libraries.,,"workflow_pipeline, comparison_benchmark",2
28155633,Multi-CAR: a tool of contig scaffolding using multiple references.,,"workflow_pipeline, using_phrases",2
25969449,GalaxyPepDock: a protein-peptide docking tool based on interaction similarity and energy optimization.,,"workflow_pipeline, using_phrases",2
31504195,VisFeature: a stand-alone program for visualizing and analyzing statistical features of biological sequences.,,"comparison_benchmark, computational_ml",2
26801957,ELASPIC web-server: proteome-wide structure-based prediction of mutation effects on protein stability and binding affinity.,elaspic,"computational_ml, using_phrases",2
31626280,CSMD: a computational subtraction-based microbiome discovery pipeline for species-level characterization of clinical metagenomic samples.,csmd,"workflow_pipeline, computational_ml",2
31091262,Mutplot: An easy-to-use online tool for plotting complex mutation data with flexibility.,,"workflow_pipeline, using_phrases",2
30825368,Aggrescan3D standalone package for structure-based prediction of protein aggregation properties.,a3d,"workflow_pipeline, computational_ml",2
23815231,WEP: a high-performance analysis pipeline for whole-exome data.,wep,"workflow_pipeline, comparison_benchmark",2
21624158,HyQue: evaluating hypotheses using Semantic Web technologies.,hyque,"comparison_benchmark, using_phrases",2
25644271,Transposome: a toolkit for annotation of transposable element families from unassembled sequence reads.,,"workflow_pipeline, using_phrases",2
24403538,Allerdictor: fast allergen prediction using text classification techniques.,,"computational_ml, using_phrases",2
32881948,PortaDrop: A portable digital microfluidic platform providing versatile opportunities for Lab-On-A-Chip applications.,,"workflow_pipeline, using_phrases",2
28203233,Exo-miRExplorer: A Comprehensive Resource for Exploring and Comparatively Analyzing Exogenous MicroRNAs.,,"comparison_benchmark, data_integration",2
32777825,APRICOT: Advanced Platform for Reproducible Infrastructures in the Cloud via Open Tools.,apricot,"workflow_pipeline, using_phrases",2
31070723,Graphical data mining of cancer mechanisms with SEMA.,sema,"data_integration, using_phrases",2
30272244,Ribose-Map: a bioinformatics toolkit to map ribonucleotides embedded in genomic DNA.,,"workflow_pipeline, using_phrases",2
33787871,Wormicloud: a new text summarization tool based on word clouds to explore the C. elegans literature.,,"workflow_pipeline, using_phrases",2
28410421,phylo-node: A molecular phylogenetic toolkit using Node.js.,,"workflow_pipeline, using_phrases",2
32140819,i6mA-Fuse: improved and robust prediction of DNA 6 mA sites in the Rosaceae genome by fusing multiple feature representation.,,"computational_ml, using_phrases",2
32640981,HEnRY: a DZIF LIMS tool for the collection and documentation of biomaterials in multicentre studies.,henry,"workflow_pipeline, using_phrases",2
25426929,"ALLocator: an interactive web platform for the analysis of metabolomic LC-ESI-MS datasets, enabling semi-automated, user-revised compound annotation and mass isotopomer ratio analysis.",,"workflow_pipeline, comparison_benchmark",2
34581565,Rapid Automated Annotation and Analysis of N-Glycan Mass Spectrometry Imaging Data Sets Using NGlycDB in METASPACE.,,"comparison_benchmark, using_phrases",2
30388204,SJARACNe: a scalable software tool for gene network reverse engineering from big data.,,"workflow_pipeline, using_phrases",2
32091584,DL4papers: a deep learning approach for the automatic interpretation of scientific articles.,,"workflow_pipeline, computational_ml",2
24788790,"ModuleRole: a tool for modulization, role determination and visualization in protein-protein interaction networks.",,"workflow_pipeline, using_phrases",2
33363710,FangNet: Mining herb hidden knowledge from TCM clinical effective formulas using structure network algorithm.,,"computational_ml, using_phrases",2
27620863,CellTree: an R/bioconductor package to infer the hierarchical structure of cell populations from single-cell RNA-seq data.,,"workflow_pipeline, using_phrases",2
27153588,Ferret: a user-friendly Java tool to extract data from the 1000 Genomes Project.,ferret,"workflow_pipeline, using_phrases",2
24495746,DRUMS: Disk Repository with Update Management and Select option for high throughput sequencing data.,drums,"using_phrases, database_update",2
29262775,ShinyGPAS: interactive genomic prediction accuracy simulator based on deterministic formulas.,,"computational_ml, using_phrases",2
27436110,PETModule: a motif module based approach for enhancer target gene prediction.,,"workflow_pipeline, computational_ml",2
31147687,Path2Surv: Pathway/gene set-based survival analysis using multiple kernel learning.,,"comparison_benchmark, using_phrases",2
31882996,Bioinformatics pipeline using JUDI: Just Do It!,judi,"workflow_pipeline, using_phrases",2
27071849,Fast and sensitive taxonomic classification for metagenomics with Kaiju.,kaiju,"computational_ml, using_phrases",2
22253821,Armadillo 1.1: an original workflow platform for designing and conducting phylogenetic analysis and simulations.,,"workflow_pipeline, comparison_benchmark",2
25009735,Unification of multi-species vertebrate anatomy ontologies for comparative biology in Uberon.,uberon,"comparison_benchmark, using_phrases",2
34108470,R2DT is a framework for predicting and visualising RNA secondary structure using templates.,r2dt,"workflow_pipeline, using_phrases",2
23292636,TargetHunter: an in silico target identification tool for predicting therapeutic potential of small organic molecules based on chemogenomic database.,,"workflow_pipeline, using_phrases",2
27867804,DFAST and DAGA: web-based integrated genome annotation tools and resources.,daga,"workflow_pipeline, data_integration",2
31477013,Cytokit: a single-cell analysis toolkit for high dimensional fluorescent microscopy imaging.,,"workflow_pipeline, comparison_benchmark",2
27105847,SL2: an interactive webtool for modeling of missing segments in proteins.,sl2,"computational_ml, using_phrases",2
32407533,MinReact: a systematic approach for identifying minimal metabolic networks.,,"workflow_pipeline, data_integration",2
23800136,MetaPathways: a modular pipeline for constructing pathway/genome databases from environmental sequence information.,,"workflow_pipeline, using_phrases",2
33848166,MAPLE: A Microbiome Analysis Pipeline Enabling Optimal Peptide Search and Comparative Taxonomic and Functional Analysis.,maple,"workflow_pipeline, comparison_benchmark",2
29454313,StructRNAfinder: an automated pipeline and web server for RNA families prediction.,,"workflow_pipeline, computational_ml",2
26153368,The ImageJ ecosystem: An open platform for biomedical image analysis.,imagej,"workflow_pipeline, comparison_benchmark",2
26722765,Introduction of the Python script STRinNGS for analysis of STR regions in FASTQ or BAM files and expansion of the Danish STR sequence database to 11 STRs.,,"comparison_benchmark, using_phrases",2
34101036,MLatom 2: An Integrative Platform for Atomistic Machine Learning.,,"workflow_pipeline, computational_ml",2
25247892,"Taxamatch, an algorithm for near ('fuzzy') matching of scientific names in taxonomic databases.",,"computational_ml, using_phrases",2
27098043,EDGAR 2.0: an enhanced software platform for comparative gene content analyses.,edgar,"workflow_pipeline, comparison_benchmark",2
28402416,ReGaTE: Registration of Galaxy Tools in Elixir.,regate,"workflow_pipeline, using_phrases",2
32267142,"iNrich, Rapid and Robust Method to Enrich N-Terminal Proteome in a Highly Multiplexed Platform.",inrich,"workflow_pipeline, using_phrases",2
34589189,Cancer DEIso: An integrative analysis platform for investigating differentially expressed gene-level and isoform-level human cancer markers.,,"workflow_pipeline, comparison_benchmark",2
28369462,drVM: a new tool for efficient genome assembly of known eukaryotic viruses from metagenomes.,drvm,"workflow_pipeline, using_phrases",2
27399597,Development of a Korean Fracture Risk Score (KFRS) for Predicting Osteoporotic Fracture Risk: Analysis of Data from the Korean National Health Insurance Service.,kfrs,"comparison_benchmark, using_phrases",2
30574164,VarQ: A Tool for the Structural and Functional Analysis of Human Protein Variants.,varq,"workflow_pipeline, comparison_benchmark",2
22635116,"OnGuard, a computational platform for quantitative kinetic modeling of guard cell physiology.",,"workflow_pipeline, computational_ml",2
24479419,QTrim: a novel tool for the quality trimming of sequence reads generated using the Roche/454 sequencing platform.,qtrim,"workflow_pipeline, using_phrases",2
33993206,"ConsRM: collection and large-scale prediction of the evolutionarily conserved RNA methylation sites, with implications for the functional epitranscriptome.",consrm,"computational_ml, using_phrases",2
21542931,The PathOlogist: an automated tool for pathway-centric analysis.,,"workflow_pipeline, comparison_benchmark",2
23617301,D-Light on promoters: a client-server system for the analysis and visualization of cis-regulatory elements.,,"comparison_benchmark, using_phrases",2
31028376,scMatch: a single-cell gene expression profile annotation tool using reference datasets.,,"workflow_pipeline, using_phrases",2
21306634,Tree Pruner: An efficient tool for selecting data from a biased genetic database.,,"workflow_pipeline, using_phrases",2
31026417,Automated Identification and Quantification of Signals in Multichannel Immunofluorescence Images: The SignalFinder-IF Platform.,,"workflow_pipeline, using_phrases",2
25712690,"LCR-eXXXplorer: a web platform to search, visualize and share data for low complexity regions in protein sequences.",,"workflow_pipeline, using_phrases",2
25455337,"A toolbox for residue iteration decomposition (RIDE)--A method for the decomposition, reconstruction, and single trial analysis of event related potentials.",ride,"workflow_pipeline, comparison_benchmark",2
22135418,Metscape 2 bioinformatics tool for the analysis and visualization of metabolomics and gene expression data.,,"workflow_pipeline, comparison_benchmark",2
22953731,CTen: a web-based platform for identifying enriched cell types from heterogeneous microarray data.,cten,"workflow_pipeline, using_phrases",2
31103932,"MyoRobot 2.0: An advanced biomechatronics platform for automated, environmentally controlled skeletal muscle single fiber biomechanics assessment employing inbuilt real-time optical imaging.",,"workflow_pipeline, comparison_benchmark",2
28028736,Fast H-DROP: A thirty times accelerated version of H-DROP for interactive SVM-based prediction of helical domain linkers.,rop,"computational_ml, database_update",2
33250866,"RhizoBindingSites, a Database of DNA-Binding Motifs in Nitrogen-Fixing Bacteria Inferred Using a Footprint Discovery Approach.",,"workflow_pipeline, using_phrases",2
33002005,"RNAthor - fast, accurate normalization, visualization and statistical analysis of RNA probing data resolved by capillary electrophoresis.",,"comparison_benchmark, computational_ml",2
23609542,BLAST: a more efficient report with usability improvements.,blast,"using_phrases, database_update",2
33408850,"<i>Vf</i>ODB: a comprehensive database of ESTs, EST-SSRs, mtSSRs, microRNA-target markers and genetic maps in <i>Vicia faba</i>.",db,"data_integration, using_phrases",2
22611129,Efficient RNA pairwise structure comparison by SETTER method.,setter,"workflow_pipeline, comparison_benchmark",2
24479510,VIP Barcoding: composition vector-based software for rapid species identification based on DNA barcoding.,,"workflow_pipeline, using_phrases",2
28904183,"The TB Portals: an Open-Access, Web-Based Platform for Global Drug-Resistant-Tuberculosis Data Sharing and Analysis.",,"workflow_pipeline, comparison_benchmark",2
26467476,"Metabolomics Workbench: An international repository for metabolomics data and metadata, metabolite standards, protocols, tutorials and training, and analysis tools.",,"workflow_pipeline, comparison_benchmark",2
31813964,Pathway Tools version 23.0 update: software for pathway/genome informatics and systems biology.,,"workflow_pipeline, database_update",2
24395359,A single-tube assembly of DNA using the transfer-PCR (TPCR) platform.,tpcr,"workflow_pipeline, using_phrases",2
24504981,The OMSSAPercolator: an automated tool to validate OMSSA results.,,"workflow_pipeline, validation_study",2
24668342,BAMS2 workspace: a comprehensive and versatile neuroinformatic platform for collating and processing neuroanatomical connections.,,"workflow_pipeline, data_integration",2
26162614,EMDLAB: A toolbox for analysis of single-trial EEG dynamics using empirical mode decomposition.,mdlab,"comparison_benchmark, using_phrases",2
22685160,"Improving links between literature and biological data with text mining: a case study with GEO, PDB and MEDLINE.",geo | pdb,"using_phrases, validation_study",2
23618375,SNVDis: a proteome-wide analysis service for evaluating nsSNVs in protein functional sites and pathways.,snvdis,"comparison_benchmark, using_phrases",2
30295728,DIGREM: an integrated web-based platform for detecting effective multi-drug combinations.,digrem,"workflow_pipeline, data_integration",2
23157388,JACOB: a dynamic database for computational chemistry benchmarking.,jacob,"comparison_benchmark, computational_ml",2
33481821,PFRED: A computational platform for siRNA and antisense oligonucleotides design.,pfred,"workflow_pipeline, computational_ml",2
33765498,"CyanoMetDB, a comprehensive public database of secondary metabolites from cyanobacteria.",,"data_integration, using_phrases",2
27131383,LassoProt: server to analyze biopolymers with lassos.,,"comparison_benchmark, using_phrases",2
31366358,HUPAN: a pan-genome analysis pipeline for human genomes.,hupan,"workflow_pipeline, comparison_benchmark",2
29718322,CoNekT: an open-source framework for comparative genomic and transcriptomic network analyses.,conekt,"workflow_pipeline, comparison_benchmark",2
33045361,tRFTar: Prediction of tRF-target gene interactions via systemic re-analysis of Argonaute CLIP-seq datasets.,trftar,"comparison_benchmark, computational_ml",2
33978706,PaIntDB: network-based omics integration and visualization using protein-protein interactions in Pseudomonas aeruginosa.,,"data_integration, using_phrases",2
23946503,omiRas: a Web server for differential expression analysis of miRNAs derived from small RNA-Seq data.,omiras,"comparison_benchmark, using_phrases",2
34104972,eSkip-Finder: a machine learning-based web application and database to identify the optimal sequences of antisense oligonucleotides for exon skipping.,,"computational_ml, validation_study",2
26576653,JSpeciesWS: a web server for prokaryotic species circumscription based on pairwise genome comparison.,,"comparison_benchmark, using_phrases",2
24895432,"CFM-ID: a web server for annotation, spectrum prediction and metabolite identification from tandem mass spectra.",cfm-id,"computational_ml, using_phrases",2
25001169,BacillusRegNet: a transcriptional regulation database and analysis platform for Bacillus species.,,"workflow_pipeline, comparison_benchmark",2
21383910,SeqMaT: A sequence manipulation tool for phylogenetic analysis.,seqmat,"workflow_pipeline, comparison_benchmark",2
32150535,ProteoClade: A taxonomic toolkit for multi-species and metaproteomic analysis.,,"workflow_pipeline, comparison_benchmark",2
33705981,TSUNAMI: Translational Bioinformatics Tool Suite for Network Analysis and Mining.,tsunami,"workflow_pipeline, comparison_benchmark",2
31588775,"ELIMU-MDx: a web-based, open-source platform for storage, management and analysis of diagnostic qPCR data.",,"workflow_pipeline, comparison_benchmark",2
33245626,"EffectorK, a comprehensive resource to mine for Ralstonia, Xanthomonas, and other published effector interactors in the Arabidopsis proteome.",,"data_integration, using_phrases",2
21622957,DARIO: a ncRNA detection and analysis tool for next-generation sequencing experiments.,dario,"workflow_pipeline, comparison_benchmark",2
26861821,TRONCO: an R package for the inference of cancer progression models from heterogeneous genomic data.,tronco,"workflow_pipeline, using_phrases",2
31160582,"CFTI5Med, the new release of the catalogue of strong earthquakes in Italy and in the Mediterranean area.",,"using_phrases, database_update",2
22319563,ECOMICS: a web-based toolkit for investigating the biomolecular web in ecosystems using a trans-omics approach.,ecomics,"workflow_pipeline, using_phrases",2
32269478,SquamataBase: a natural history database and R package for comparative biology of snake feeding habits.,,"workflow_pipeline, comparison_benchmark",2
32282909,"TREND: a platform for exploring protein function in prokaryotes based on phylogenetic, domain architecture and gene neighborhood analyses.",trend,"workflow_pipeline, using_phrases",2
27307005,HLAsupE: an integrated database of HLA supertype-specific epitopes to aid in the development of vaccines with broad coverage of the human population.,,"data_integration, using_phrases",2
22768184,BiofOmics: a Web platform for the systematic and standardized collection of high-throughput biofilm data.,,"workflow_pipeline, data_integration",2
33175089,COVID-KOP: integrating emerging COVID-19 data with the ROBOKOP database.,covid-kop,"data_integration, using_phrases",2
23686313,PPISURV: a novel bioinformatics tool for uncovering the hidden role of specific genes in cancer survival outcome.,ppisurv,"workflow_pipeline, using_phrases",2
