pmid,title,entity,false_positive_reason,pattern_categories,num_patterns
25935118,Gene network coherence based on prior knowledge using direct and indirect relationships.,g,Uses resource as analysis tool; Describes method/approach based on resource data; Multiple usage indicators (2 categories),"using_with, based_approach",2
24792048,A protocol for visual analysis of alternative splicing in RNA-Seq data using integrated genome browser.,,Uses resource as analysis tool; Focuses on analysis/study using data from resource; Multiple usage indicators (2 categories),"using_with, analysis_study",2
33438699,Microliter ultrafast centrifuge platform for size-based particle and cell separation and extraction using novel omnidirectional spiral surface acoustic waves.,,Uses resource as analysis tool; Multiple usage indicators (2 categories),"using_with, tool_for",2
31917401,contamDE-lm: linear model-based differential gene expression analysis using next-generation RNA-seq data from contaminated tumor samples.,,Uses resource as analysis tool; Focuses on analysis/study using data from resource; Multiple usage indicators (2 categories),"using_with, analysis_study",2
33592504,TAP 1.0: A robust immunoinformatic tool for the prediction of tumor T-cell antigens based on AAindex properties.,tap 1,Describes method/approach based on resource data; Multiple usage indicators (2 categories),"based_approach, tool_for",2
25826379,UK biobank: an open access resource for identifying the causes of a wide range of complex diseases of middle and old age.,,Uses resource as analysis tool; Multiple usage indicators (2 categories),"reveals_identifies, tool_for",2
26473729,Gene-Set Local Hierarchical Clustering (GSLHC)--A Gene Set-Based Approach for Characterizing Bioactive Compounds in Terms of Biological Functional Groups.,gslhc,Describes method/approach based on resource data; Multiple usage indicators (2 categories),"based_approach, tool_for",2
22464351,A platform for dynamic simulation and control of movement based on OpenSim and MATLAB.,,Describes method/approach based on resource data; Multiple usage indicators (2 categories),"based_approach, tool_for",2
30066656,Query-constraint-based mining of association rules for exploratory analysis of clinical datasets in the National Sleep Research Resource.,,Focuses on analysis/study using data from resource; Data mining/querying of existing resource; Multiple usage indicators (2 categories),"analysis_study, mining_data",2
29297283,R3D-BLAST2: an improved search tool for similar RNA 3D substructures.,r3d,Data mining/querying of existing resource; Multiple usage indicators (2 categories),"mining_data, tool_for",2
31504171,New insights on human essential genes based on integrated analysis and the construction of the HEGIAP web-based platform.,hegiap,Focuses on analysis/study using data from resource; Describes method/approach based on resource data; Multiple usage indicators (2 categories),"analysis_study, based_approach",2
23751181,Using Genome Query Language to uncover genetic variation.,,Uses resource as analysis tool; Multiple usage indicators (2 categories),"using_with, reveals_identifies",2
31212742,Systematic Analysis of a Military Wearable Device Based on a Multi-Level Fusion Framework: Research Directions.,,Focuses on analysis/study using data from resource; Describes method/approach based on resource data; Multiple usage indicators (2 categories),"analysis_study, based_approach",2
34213323,pdCSM-cancer: Using Graph-Based Signatures to Identify Small Molecules with Anticancer Properties.,,Uses resource as analysis tool; Multiple usage indicators (2 categories),"using_with, reveals_identifies",2
33750297,Rust expression browser: an open source database for simultaneous analysis of host and pathogen gene expression profiles with expVIP.,,Uses resource as analysis tool; Focuses on analysis/study using data from resource; Multiple usage indicators (2 categories),"using_with, analysis_study",2
22369237,INDUS - a composition-based approach for rapid and accurate taxonomic classification of metagenomic sequences.,indus,Describes method/approach based on resource data; Multiple usage indicators (2 categories),"based_approach, tool_for",2
23330685,BioSM: metabolomics tool for identifying endogenous mammalian biochemical structures in chemical structure space.,biosm,Uses resource as analysis tool; Multiple usage indicators (2 categories),"reveals_identifies, tool_for",2
31790389,CDSeq: A novel complete deconvolution method for dissecting heterogeneous samples using gene expression data.,cdseq,Uses resource as analysis tool; Multiple usage indicators (2 categories),"using_with, tool_for",2
28542466,ToNER: A tool for identifying nucleotide enrichment signals in feature-enriched RNA-seq data.,toner,Uses resource as analysis tool; Multiple usage indicators (2 categories),"reveals_identifies, tool_for",2
26784691,iMet-Q: A User-Friendly Tool for Label-Free Metabolomics Quantitation Using Dynamic Peak-Width Determination.,imet-q,Uses resource as analysis tool; Multiple usage indicators (2 categories),"using_with, tool_for",2
33335686,ProdMX: Rapid query and analysis of protein functional domain based on compressed sparse matrices.,prodmx,Focuses on analysis/study using data from resource; Describes method/approach based on resource data; Multiple usage indicators (2 categories),"analysis_study, based_approach",2
26671801,BMExpert: Mining MEDLINE for Finding Experts in Biomedical Domains Based on Language Model.,,Describes method/approach based on resource data; Data mining/querying of existing resource; Multiple usage indicators (2 categories),"based_approach, mining_data",2
24503543,DRUGSURV: a resource for repositioning of approved and experimental drugs in oncology based on patient survival information.,drugsurv,Describes method/approach based on resource data; Multiple usage indicators (2 categories),"based_approach, tool_for",2
32449936,CVCDAP: an integrated platform for molecular and clinical analysis of cancer virtual cohorts.,cvcdap,Focuses on analysis/study using data from resource; Multiple usage indicators (2 categories),"analysis_study, tool_for",2
29237557,eRepo-ORP: Exploring the Opportunity Space to Combat Orphan Diseases with Existing Drugs.,,Uses resource as analysis tool; Data mining/querying of existing resource; Multiple usage indicators (2 categories),"using_with, mining_data",2
28970546,TM-Aligner: Multiple sequence alignment tool for transmembrane proteins with reduced time and improved accuracy.,,Uses resource as analysis tool; Multiple usage indicators (2 categories),"using_with, tool_for",2
29028907,OncomiR: an online resource for exploring pan-cancer microRNA dysregulation.,,Data mining/querying of existing resource; Multiple usage indicators (2 categories),"mining_data, tool_for",2
31114925,ImmuneRegulation: a web-based tool for identifying human immune regulatory elements.,,Uses resource as analysis tool; Multiple usage indicators (2 categories),"reveals_identifies, tool_for",2
30821318,SW-Tandem: a highly efficient tool for large-scale peptide identification with parallel spectrum dot product on Sunway TaihuLight.,,Uses resource as analysis tool; Multiple usage indicators (2 categories),"using_with, tool_for",2
32397982,TAMA: improved metagenomic sequence classification through meta-analysis.,tama,Uses resource as analysis tool; Focuses on analysis/study using data from resource; Multiple usage indicators (2 categories),"using_with, analysis_study",2
24135450,ReVeaLD: a user-driven domain-specific interactive search platform for biomedical research.,,Data mining/querying of existing resource; Multiple usage indicators (2 categories),"mining_data, tool_for",2
28529081,"SysFinder: A customized platform for search, comparison and assisted design of appropriate animal models based on systematic similarity.",,Describes method/approach based on resource data; Multiple usage indicators (2 categories),"based_approach, tool_for",2
25040013,Identifying mouse models for skin cancer using the Mouse Tumor Biology Database.,,Uses resource as analysis tool; Multiple usage indicators (2 categories),"using_with, reveals_identifies",2
27348712,The Perseus computational platform for comprehensive analysis of (prote)omics data.,,Focuses on analysis/study using data from resource; Multiple usage indicators (2 categories),"analysis_study, tool_for",2
30624692,PopCluster: an algorithm to identify genetic variants with ethnicity-dependent effects.,,Uses resource as analysis tool; Multiple usage indicators (2 categories),"using_with, reveals_identifies",2
24699831,"MetalS(3), a database-mining tool for the identification of structurally similar metal sites.",,Data mining/querying of existing resource; Multiple usage indicators (2 categories),"mining_data, tool_for",2
23819467,BioBin: a bioinformatics tool for automating the binning of rare variants using publicly available biological knowledge.,biobin,Uses resource as analysis tool; Multiple usage indicators (2 categories),"using_with, tool_for",2
27608726,COME: a robust coding potential calculation tool for lncRNA identification and characterization based on multiple features.,come,Describes method/approach based on resource data; Multiple usage indicators (2 categories),"based_approach, tool_for",2
27573070,gFinder: A Web-Based Bioinformatics Tool for the Analysis of N-Glycopeptides.,,Focuses on analysis/study using data from resource; Multiple usage indicators (2 categories),"analysis_study, tool_for",2
33186463,Exploring functionally annotated transcriptional consensus regulatory elements with CONREL.,conrel,Uses resource as analysis tool; Data mining/querying of existing resource; Multiple usage indicators (2 categories),"using_with, mining_data",2
30217829,Observed Antibody Space: A Resource for Data Mining Next-Generation Sequencing of Antibody Repertoires.,,Data mining/querying of existing resource; Multiple usage indicators (2 categories),"mining_data, tool_for",2
26590258,"MitoAge: a database for comparative analysis of mitochondrial DNA, with a special focus on animal longevity.",,Uses resource as analysis tool; Focuses on analysis/study using data from resource; Multiple usage indicators (2 categories),"using_with, analysis_study",2
21410990,AnyExpress: integrated toolkit for analysis of cross-platform gene expression data using a fast interval matching algorithm.,,Uses resource as analysis tool; Focuses on analysis/study using data from resource; Multiple usage indicators (2 categories),"using_with, analysis_study",2
25506822,VAAPA: a web platform for visualization and analysis of alternative polyadenylation.,vaapa,Focuses on analysis/study using data from resource; Multiple usage indicators (2 categories),"analysis_study, tool_for",2
34883995,COLAEVA: Visual Analytics and Data Mining Web-Based Tool for Virtual Coaching of Older Adult Populations.,colaeva,Data mining/querying of existing resource; Multiple usage indicators (2 categories),"mining_data, tool_for",2
31504165,COMBAT-TB-NeoDB: fostering tuberculosis research through integrative analysis using graph database technologies.,,Uses resource as analysis tool; Focuses on analysis/study using data from resource; Multiple usage indicators (2 categories),"using_with, analysis_study",2
32738892,RiboMiner: a toolset for mining multi-dimensional features of the translatome with ribosome profiling data.,,Uses resource as analysis tool; Data mining/querying of existing resource; Multiple usage indicators (2 categories),"using_with, mining_data",2
32960944,MMAP: a cloud computing platform for mining the maximum accuracy of predicting phenotypes from genotypes.,mmap,Data mining/querying of existing resource; Multiple usage indicators (2 categories),"mining_data, tool_for",2
23593247,DomHR: accurately identifying domain boundaries in proteins using a hinge region strategy.,domhr,Uses resource as analysis tool; Multiple usage indicators (2 categories),"using_with, reveals_identifies",2
33212503,DeepBL: a deep learning-based approach for in silico discovery of beta-lactamases.,deepbl,Describes method/approach based on resource data; Multiple usage indicators (2 categories),"based_approach, tool_for",2
"22064862, 24185697",The Candida genome database incorporates multiple Candida species: multispecies search and analysis tools with curated gene and protein information for Candida albicans and Candida glabrata.,,Uses resource as analysis tool; Data mining/querying of existing resource; Multiple usage indicators (2 categories),"using_with, mining_data",2
29944754,iReceptor: A platform for querying and analyzing antibody/B-cell and T-cell receptor repertoire data across federated repositories.,,Data mining/querying of existing resource; Multiple usage indicators (2 categories),"mining_data, tool_for",2
23766290,INMEX--a web-based tool for integrative meta-analysis of expression data.,inmex,Focuses on analysis/study using data from resource; Multiple usage indicators (2 categories),"analysis_study, tool_for",2
30201843,Geppetto: a reusable modular open platform for exploring neuroscience data and models.,,Data mining/querying of existing resource; Multiple usage indicators (2 categories),"mining_data, tool_for",2
25122463,RLIMS-P: an online text-mining tool for literature-based extraction of protein phosphorylation information.,rlims-p,Data mining/querying of existing resource; Multiple usage indicators (2 categories),"mining_data, tool_for",2
32212654,CIRFESS: An Interactive Resource for Querying the Set of Theoretically Detectable Peptides for Cell Surface and Extracellular Enrichment Proteomic Studies.,cirfess,Data mining/querying of existing resource; Multiple usage indicators (2 categories),"mining_data, tool_for",2
24330842,TRAPID: an efficient online tool for the functional and comparative analysis of de novo RNA-Seq transcriptomes.,trapid,Focuses on analysis/study using data from resource; Multiple usage indicators (2 categories),"analysis_study, tool_for",2
25420108,Synergy: a web resource for exploring gene regulation in Synechocystis sp. PCC6803.,,Data mining/querying of existing resource; Multiple usage indicators (2 categories),"mining_data, tool_for",2
25173349,"Economic evaluation of a brief education, self-management and upper limb exercise training in people with rheumatoid arthritis (EXTRA) programme: a trial-based analysis.",extra,Uses resource as analysis tool; Describes method/approach based on resource data; Multiple usage indicators (2 categories),"using_with, based_approach",2
25100685,BioTextQuest(+): a knowledge integration platform for literature mining and concept discovery.,,Data mining/querying of existing resource; Multiple usage indicators (2 categories),"mining_data, tool_for",2
21602264,miRvestigator: web application to identify miRNAs responsible for co-regulated gene expression patterns discovered through transcriptome profiling.,,Uses resource as analysis tool; Multiple usage indicators (2 categories),"using_with, reveals_identifies",2
30944313,Metascape provides a biologist-oriented resource for the analysis of systems-level datasets.,,Focuses on analysis/study using data from resource; Multiple usage indicators (2 categories),"analysis_study, tool_for",2
24312246,"PIIKA 2: an expanded, web-based platform for analysis of kinome microarray data.",piika 2,Focuses on analysis/study using data from resource; Multiple usage indicators (2 categories),"analysis_study, tool_for",2
28150236,Bioinformatics Analysis of Protein Phosphorylation in Plant Systems Biology Using P3DB.,p3db,Uses resource as analysis tool; Focuses on analysis/study using data from resource; Multiple usage indicators (2 categories),"using_with, analysis_study",2
28158419,NSSRF: global network similarity search with subgraph signatures and its applications.,nssrf,Uses resource as analysis tool; Data mining/querying of existing resource; Multiple usage indicators (2 categories),"using_with, mining_data",2
28982288,MPTM: A tool for mining protein post-translational modifications from literature.,mptm,Data mining/querying of existing resource; Multiple usage indicators (2 categories),"mining_data, tool_for",2
32353048,Nutrimedia: A novel web-based resource for the general public that evaluates the veracity of nutrition claims using the GRADE approach.,,Uses resource as analysis tool; Multiple usage indicators (2 categories),"using_with, tool_for",2
24705205,HPVdb: a data mining system for knowledge discovery in human papillomavirus with applications in T cell immunology and vaccinology.,hpvdb,Uses resource as analysis tool; Data mining/querying of existing resource; Multiple usage indicators (2 categories),"using_with, mining_data",2
30517749,ORTHOSCOPE: An Automatic Web Tool for Phylogenetically Inferring Bilaterian Orthogroups with User-Selected Taxa.,orthoscope,Uses resource as analysis tool; Multiple usage indicators (2 categories),"using_with, tool_for",2
22856375,EnigmaVis: online interactive visualization of genome-wide association studies of the Enhancing NeuroImaging Genetics through Meta-Analysis (ENIGMA) consortium.,,Uses resource as analysis tool; Focuses on analysis/study using data from resource; Multiple usage indicators (2 categories),"using_with, analysis_study",2
28100700,PBrowse: a web-based platform for real-time collaborative exploration of genomic data.,,Data mining/querying of existing resource; Multiple usage indicators (2 categories),"mining_data, tool_for",2
31853227,GBDTCDA: Predicting circRNA-disease Associations Based on Gradient Boosting Decision Tree with Multiple Biological Data Fusion.,gbdtcda,Uses resource as analysis tool; Describes method/approach based on resource data; Multiple usage indicators (2 categories),"using_with, based_approach",2
32392342,"EnzymeMiner: automated mining of soluble enzymes with diverse structures, catalytic properties and stabilities.",,Uses resource as analysis tool; Data mining/querying of existing resource; Multiple usage indicators (2 categories),"using_with, mining_data",2
28336542,"Seten: a tool for systematic identification and comparison of processes, phenotypes, and diseases associated with RNA-binding proteins from condition-specific CLIP-seq profiles.",seten,Uses resource as analysis tool; Multiple usage indicators (2 categories),"using_with, tool_for",2
31069394,AlloDriver: a method for the identification and analysis of cancer driver targets.,,Focuses on analysis/study using data from resource; Multiple usage indicators (2 categories),"analysis_study, tool_for",2
23496817,CGAP: a new comprehensive platform for the comparative analysis of chloroplast genomes.,cgap,Focuses on analysis/study using data from resource; Multiple usage indicators (2 categories),"analysis_study, tool_for",2
31199464,CoCoScore: context-aware co-occurrence scoring for text mining applications using distant supervision.,,Uses resource as analysis tool; Data mining/querying of existing resource; Multiple usage indicators (2 categories),"using_with, mining_data",2
23026555,"MetaSAMS--a novel software platform for taxonomic classification, functional annotation and comparative analysis of metagenome datasets.",,Focuses on analysis/study using data from resource; Multiple usage indicators (2 categories),"analysis_study, tool_for",2
32606005,LDtrait: An Online Tool for Identifying Published Phenotype Associations in Linkage Disequilibrium.,,Uses resource as analysis tool; Multiple usage indicators (2 categories),"reveals_identifies, tool_for",2
31760951,TS-GOEA: a web tool for tissue-specific gene set enrichment analysis based on gene ontology.,ts-goea,Describes method/approach based on resource data; Multiple usage indicators (2 categories),"based_approach, tool_for",2
30241466,ECPred: a tool for the prediction of the enzymatic functions of protein sequences based on the EC nomenclature.,ecpred,Describes method/approach based on resource data; Multiple usage indicators (2 categories),"based_approach, tool_for",2
30097004,miREM: an expectation-maximization approach for prioritizing miRNAs associated with gene-set.,mirem,Uses resource as analysis tool; Multiple usage indicators (2 categories),"using_with, tool_for",2
"23160414, 23703206",Accelerating literature curation with text-mining tools: a case study of using PubTator to curate genes in PubMed abstracts.,,Uses resource as analysis tool; Data mining/querying of existing resource; Multiple usage indicators (2 categories),"using_with, mining_data",2
27814681,WUFlux: an open-source platform for <sup>13</sup>C metabolic flux analysis of bacterial metabolism.,wuflux,Focuses on analysis/study using data from resource; Multiple usage indicators (2 categories),"analysis_study, tool_for",2
29189001,Searching Online Chemical Data Repositories via the ChemAgora Portal.,,Uses resource as analysis tool; Data mining/querying of existing resource; Multiple usage indicators (2 categories),"using_with, mining_data",2
34500471,scDeepSort: a pre-trained cell-type annotation method for single-cell transcriptomics using deep learning with a weighted graph neural network.,,Uses resource as analysis tool; Multiple usage indicators (2 categories),"using_with, tool_for",2
"26669964, 29322439",CircInteractome: A web tool for exploring circular RNAs and their interacting proteins and microRNAs.,,Data mining/querying of existing resource; Multiple usage indicators (2 categories),"mining_data, tool_for",2
30715466,SpyCLIP: an easy-to-use and high-throughput compatible CLIP platform for the characterization of protein-RNA interactions with high accuracy.,,Uses resource as analysis tool; Multiple usage indicators (2 categories),"using_with, tool_for",2
29272359,"BioSeq-Analysis: a platform for DNA, RNA and protein sequence analysis based on machine learning approaches.",,Describes method/approach based on resource data; Multiple usage indicators (2 categories),"based_approach, tool_for",2
25708359,ViralmiR: a support-vector-machine-based method for predicting viral microRNA precursors.,,Describes method/approach based on resource data; Multiple usage indicators (2 categories),"based_approach, tool_for",2
"22600742, 28981577",O-miner: an integrative platform for automated analysis and mining of -omics data.,,Data mining/querying of existing resource; Multiple usage indicators (2 categories),"mining_data, tool_for",2
27835690,Vidjil: A Web Platform for Analysis of High-Throughput Repertoire Sequencing.,vidjil,Focuses on analysis/study using data from resource; Multiple usage indicators (2 categories),"analysis_study, tool_for",2
22761559,ProteinHistorian: tools for the comparative analysis of eukaryote protein origin.,,Focuses on analysis/study using data from resource; Multiple usage indicators (2 categories),"analysis_study, tool_for",2
28268841,AMP: A platform for managing and mining data in the treatment of Autism Spectrum Disorder.,amp,Data mining/querying of existing resource; Multiple usage indicators (2 categories),"mining_data, tool_for",2
32471392,BEAVR: a browser-based tool for the exploration and visualization of RNA-seq data.,beavr,Data mining/querying of existing resource; Multiple usage indicators (2 categories),"mining_data, tool_for",2
"23599922, 24578403",LASAGNA-Search: an integrated web tool for transcription factor binding site search and visualization.,,Data mining/querying of existing resource; Multiple usage indicators (2 categories),"mining_data, tool_for",2
31504851,"BioSeq-Analysis2.0: an updated platform for analyzing DNA, RNA and protein sequences at sequence level and residue level based on machine learning approaches.",,Describes method/approach based on resource data; Multiple usage indicators (2 categories),"based_approach, tool_for",2
24484385,uPEPperoni: an online tool for upstream open reading frame location and analysis of transcript conservation.,,Focuses on analysis/study using data from resource; Multiple usage indicators (2 categories),"analysis_study, tool_for",2
26773573,"VariOtator, a Software Tool for Variation Annotation with the Variation Ontology.",,Uses resource as analysis tool; Multiple usage indicators (2 categories),"using_with, tool_for",2
28387604,DES-ncRNA: A knowledgebase for exploring information about human micro and long noncoding RNAs based on literature-mining.,,Describes method/approach based on resource data; Data mining/querying of existing resource; Multiple usage indicators (2 categories),"based_approach, mining_data",2
26220891,GeneMatcher: a matching tool for connecting investigators with an interest in the same gene.,,Uses resource as analysis tool; Multiple usage indicators (2 categories),"using_with, tool_for",2
25358478,MS-GF+ makes progress towards a universal database search tool for proteomics.,ms-gf,Data mining/querying of existing resource; Multiple usage indicators (2 categories),"mining_data, tool_for",2
31116477,MetaDome: Pathogenicity analysis of genetic variants through aggregation of homologous human protein domains.,,Uses resource as analysis tool; Focuses on analysis/study using data from resource; Multiple usage indicators (2 categories),"using_with, analysis_study",2
33324449,Web-Based Genome Analysis of Bacterial Meningitis Pathogens for Public Health Applications Using the Bacterial Meningitis Genomic Analysis Platform (BMGAP).,bmgap,Uses resource as analysis tool; Focuses on analysis/study using data from resource; Multiple usage indicators (2 categories),"using_with, analysis_study",2
24215026,PTMTreeSearch: a novel two-stage tree-search algorithm with pruning rules for the identification of post-translational modification of proteins in MS/MS spectra.,,Uses resource as analysis tool; Data mining/querying of existing resource; Multiple usage indicators (2 categories),"using_with, mining_data",2
