pmid,title,entity,false_positive_reason,pattern_categories,num_patterns
27616708,ImmuneDB: a system for the analysis and exploration of high-throughput adaptive immune receptor sequencing data.,,Data mining/querying of existing resource,mining_data,1
26002883,pwOmics: an R package for pathway-based integration of time-series omics data using public database knowledge.,,Uses resource as analysis tool,using_with,1
22955989,Annotation of functional variation in personal genomes using RegulomeDB.,,Uses resource as analysis tool,using_with,1
30781586,CVm6A: A Visualization and Exploration Database for mâ¶As in Cell Lines.,cvm6a,Data mining/querying of existing resource,mining_data,1
32313959,Zebra2: advanced and easy-to-use web-server for bioinformatic analysis of subfamily-specific and conserved positions in diverse protein superfamilies.,zebra2,Focuses on analysis/study using data from resource,analysis_study,1
24700812,3PFDB+: improved search protocol and update for the identification of representatives of protein sequence domain families.,3pfdb,Data mining/querying of existing resource,mining_data,1
34663069,TopProperty: Robust Metaprediction of Transmembrane and Globular Protein Features Using Deep Neural Networks.,,Uses resource as analysis tool,using_with,1
27832067,MinePath: Mining for Phenotype Differential Sub-paths in Molecular Pathways.,,Data mining/querying of existing resource,mining_data,1
25653163,CAGEr: precise TSS data retrieval and high-resolution promoterome mining for integrative analyses.,cager,Data mining/querying of existing resource,mining_data,1
34048569,IUPred3: prediction of protein disorder enhanced with unambiguous experimental annotation and visualization of evolutionary conservation.,iupred,Uses resource as analysis tool,using_with,1
32329672,MedGen: NCBI's Portal to Information on Medical Conditions with a Genetic Component.,medgen,Uses resource as analysis tool,using_with,1
28415074,NaviCom: a web application to create interactive molecular network portraits using multi-level omics data.,,Uses resource as analysis tool,using_with,1
32082621,FibroAtlas: A Database for the Exploration of Fibrotic Diseases and Their Genes.,,Data mining/querying of existing resource,mining_data,1
26313379,GARN: Sampling RNA 3D Structure Space with Game Theory and Knowledge-Based Scoring Strategies.,garn,Uses resource as analysis tool,using_with,1
30753479,RiceMetaSysB: a database of blast and bacterial blight responsive genes in rice and its utilization in identifying key blast-resistant WRKY genes.,,Uses resource as analysis tool,reveals_identifies,1
26399714,htsint: a Python library for sequencing pipelines that combines data through gene set generation.,htsint,Uses resource as analysis tool,using_with,1
31850063,LD-annot: A Bioinformatics Tool to Automatically Provide Candidate SNPs With Annotations for Genetically Linked Genes.,,Uses resource as analysis tool,using_with,1
29452392,pBRIT: gene prioritization by correlating functional and phenotypic annotations through integrative data fusion.,pbrit,Uses resource as analysis tool,using_with,1
25863133,PlantMirnaT: miRNA and mRNA integrated analysis fully utilizing characteristics of plant sequencing data.,,Focuses on analysis/study using data from resource,analysis_study,1
31029079,CSESA: an R package to predict Salmonella enterica serotype based on newly incorporated spacer pairs of CRISPR.,csesa,Describes method/approach based on resource data,based_approach,1
32849767,rboAnalyzer: A Software to Improve Characterization of Non-coding RNAs From Sequence Database Search Output.,,Data mining/querying of existing resource,mining_data,1
31425122,FlyIT: Drosophila Embryogenesis Image Annotation based on Image Tiling and Convolutional Neural Networks.,flyit,Describes method/approach based on resource data,based_approach,1
22582806,PROLIX: rapid mining of protein-ligand interactions in large crystal structure databases.,prolix,Data mining/querying of existing resource,mining_data,1
29985979,RNAvista: a webserver to assess RNA secondary structures with non-canonical base pairs.,,Uses resource as analysis tool,using_with,1
31295871,TGStools: A Bioinformatics Suit to Facilitate Transcriptome Analysis of Long Reads from Third Generation Sequencing Platform.,,Focuses on analysis/study using data from resource,analysis_study,1
34104972,eSkip-Finder: a machine learning-based web application and database to identify the optimal sequences of antisense oligonucleotides for exon skipping.,,Uses resource as analysis tool,reveals_identifies,1
23946503,omiRas: a Web server for differential expression analysis of miRNAs derived from small RNA-Seq data.,omiras,Focuses on analysis/study using data from resource,analysis_study,1
33978706,PaIntDB: network-based omics integration and visualization using protein-protein interactions in Pseudomonas aeruginosa.,,Uses resource as analysis tool,using_with,1
26714571,"Pathosphere.org: pathogen detection and characterization through a web-based, openÂ source informatics platform.",,Uses resource as analysis tool,using_with,1
23110816,Sagace: a web-based search engine for biomedical databases in Japan.,sagace,Data mining/querying of existing resource,mining_data,1
34393586,"Kakila database: Towards a FAIR community approved database of cetacean presence in the waters of the Guadeloupe Archipelago, based on citizen science.",kakila,Describes method/approach based on resource data,based_approach,1
31577829,"ProphET, prophage estimation tool: A stand-alone prophage sequence prediction tool with self-updating reference database.",,Uses resource as analysis tool,using_with,1
30417014,Parallel MapReduce: Maximizing Cloud Resource Utilization and Performance Improvement Using Parallel Execution Strategies.,,Uses resource as analysis tool,using_with,1
23046922,Parallel-META: efficient metagenomic data analysis based on high-performance computation.,,Describes method/approach based on resource data,based_approach,1
25306238,VAS: a convenient web portal for efficient integration of genomic features with millions of genetic variants.,vas,Uses resource as analysis tool,using_with,1
31799603,"mitoXplorer, a visual data mining platform to systematically analyze and visualize mitochondrial expression dynamics and mutations.",,Data mining/querying of existing resource,mining_data,1
31028376,scMatch: a single-cell gene expression profile annotation tool using reference datasets.,,Uses resource as analysis tool,using_with,1
28775335,NuBBE<sub>DB</sub>: an updated database to uncover chemical and biological information from Brazilian biodiversity.,nubbe,Uses resource as analysis tool,reveals_identifies,1
27663499,FastRFS: fast and accurate Robinson-Foulds Supertrees using constrained exact optimization.,,Uses resource as analysis tool,using_with,1
33649586,Fast searches of large collections of single-cell data using scfind.,scfind,Uses resource as analysis tool,using_with,1
27084939,RBscore&NBench: a high-level web server for nucleic acid binding residues prediction with a large-scale benchmarking database.,,Uses resource as analysis tool,using_with,1
26559507,BRAKER1: Unsupervised RNA-Seq-Based Genome Annotation with GeneMark-ET and AUGUSTUS.,braker1,Uses resource as analysis tool,using_with,1
26828375,FastaHerder2: Four Ways to Research Protein Function and Evolution with Clustering and Clustered Databases.,,Uses resource as analysis tool,using_with,1
33993206,"ConsRM: collection and large-scale prediction of the evolutionarily conserved RNA methylation sites, with implications for the functional epitranscriptome.",consrm,Uses resource as analysis tool,using_with,1
31624250,An accurate registration of the BigBrain dataset with the MNI PD25 and ICBM152 atlases.,,Uses resource as analysis tool,using_with,1
23173819,TIGRESS: Trustful Inference of Gene REgulation using Stability Selection.,tigress,Uses resource as analysis tool,using_with,1
28472422,PharmMapper 2017 update: a web server for potential drug target identification with a comprehensive target pharmacophore database.,,Uses resource as analysis tool,using_with,1
22559942,Tavaxy: integrating Taverna and Galaxy workflows with cloud computing support.,tavaxy,Uses resource as analysis tool,using_with,1
27399597,Development of a Korean Fracture Risk Score (KFRS) for Predicting Osteoporotic Fracture Risk: Analysis of Data from the Korean National Health Insurance Service.,kfrs,Focuses on analysis/study using data from resource,analysis_study,1
22454539,Platform-independent and label-free quantitation of proteomic data using MS1 extracted ion chromatograms in skyline: application to protein acetylation and phosphorylation.,,Uses resource as analysis tool,using_with,1
28028736,Fast H-DROP: A thirty times accelerated version of H-DROP for interactive SVM-based prediction of helical domain linkers.,rop,Describes method/approach based on resource data,based_approach,1
31782758,Proactive visual and statistical analysis of genomic data in Epiviz.,epiviz,Focuses on analysis/study using data from resource,analysis_study,1
33250866,"RhizoBindingSites, a Database of DNA-Binding Motifs in Nitrogen-Fixing Bacteria Inferred Using a Footprint Discovery Approach.",,Uses resource as analysis tool,using_with,1
30053271,PharmacoDB: an integrative database for mining in vitro anticancer drug screening studies.,,Data mining/querying of existing resource,mining_data,1
32661425,GPCRmd uncovers the dynamics of the 3D-GPCRome.,gpcrmd,Uses resource as analysis tool,reveals_identifies,1
27131383,LassoProt: server to analyze biopolymers with lassos.,,Uses resource as analysis tool,using_with,1
30376049,RTPDB: a database providing associations between genetic variation or expression and cancer prognosis with radiotherapy-based treatment.,rtpdb,Uses resource as analysis tool,using_with,1
23894142,MaGnET: Malaria Genome Exploration Tool.,magnet,Data mining/querying of existing resource,mining_data,1
22685160,"Improving links between literature and biological data with text mining: a case study with GEO, PDB and MEDLINE.",geo | pdb,Uses resource as analysis tool,using_with,1
32652926,Keras R-CNN: library for cell detection in biological images using deep neural networks.,cnn,Uses resource as analysis tool,using_with,1
23304279,"Meeting the electronic health record ""meaningful use"" criterion for the HL7 infobutton standard using OpenInfobutton and the Librarian Infobutton Tailoring Environment (LITE).",,Uses resource as analysis tool,using_with,1
30477418,"pyHIVE, a health-related image visualization and engineering system using Python.",pyhive,Uses resource as analysis tool,using_with,1
24395359,A single-tube assembly of DNA using the transfer-PCR (TPCR) platform.,tpcr,Uses resource as analysis tool,using_with,1
24479510,VIP Barcoding: composition vector-based software for rapid species identification based on DNA barcoding.,,Describes method/approach based on resource data,based_approach,1
30735513,Using the CustusX toolkit to create an image guided bronchoscopy application: Fraxinus.,,Uses resource as analysis tool,using_with,1
33028846,Graph-based exploitation of gene ontology using GOxploreR for scrutinizing biological significance.,,Uses resource as analysis tool,using_with,1
30064374,TOPAZ: asymmetric suffix array neighbourhood search for massive protein databases.,topaz,Data mining/querying of existing resource,mining_data,1
23609542,BLAST: a more efficient report with usability improvements.,blast,Uses resource as analysis tool,using_with,1
33002005,"RNAthor - fast, accurate normalization, visualization and statistical analysis of RNA probing data resolved by capillary electrophoresis.",,Focuses on analysis/study using data from resource,analysis_study,1
22374845,Integration of the OpenIGTLink network protocol for image-guided therapy with the medical platform MeVisLab.,,Uses resource as analysis tool,using_with,1
26072498,FERAL: network-based classifier with application to breast cancer outcome prediction.,feral,Uses resource as analysis tool,using_with,1
21524302,Simrank: Rapid and sensitive general-purpose k-mer search tool.,,Data mining/querying of existing resource,mining_data,1
24336806,NetCoffee: a fast and accurate global alignment approach to identify functionally conserved proteins in multiple networks.,,Uses resource as analysis tool,reveals_identifies,1
34362304,BREC: an R package/Shiny app for automatically identifying heterochromatin boundaries and estimating local recombination rates along chromosomes.,brec,Uses resource as analysis tool,reveals_identifies,1
34050164,Automated annotation and visualisation of high-resolution spatial proteomic mass spectrometry imaging data using HIT-MAP.,hit-map,Uses resource as analysis tool,using_with,1
21349868,Gene List significance at-a-glance with GeneValorization.,,Uses resource as analysis tool,using_with,1
25613183,Being PRO-ACTive: What can a Clinical Trial Database Reveal About ALS?,pro-act,Uses resource as analysis tool,reveals_identifies,1
28061810,Pyviko: an automated Python tool to design gene knockouts in complex viruses with overlapping genes.,pyviko,Uses resource as analysis tool,using_with,1
23436208,Share and enjoy: anatomical models database--generating and sharing cardiovascular model data using web services.,amdb,Uses resource as analysis tool,using_with,1
32128697,Titta: A toolbox for creating PsychToolbox and Psychopy experiments with Tobii eye trackers.,titta,Uses resource as analysis tool,using_with,1
23667459,The PARIGA server for real time filtering and analysis of reciprocal BLAST results.,pariga,Focuses on analysis/study using data from resource,analysis_study,1
26210358,VCF-Miner: GUI-based application for mining variants and annotations stored in VCF files.,,Data mining/querying of existing resource,mining_data,1
29868863,ProAcePred: prokaryote lysine acetylation sites prediction based on elastic net feature optimization.,,Describes method/approach based on resource data,based_approach,1
25338717,FlaiMapper: computational annotation of small ncRNA-derived fragments using RNA-seq high-throughput data.,,Uses resource as analysis tool,using_with,1
25708243,SCMPSP: Prediction and characterization of photosynthetic proteins based on a scoring card method.,scmpsp,Describes method/approach based on resource data,based_approach,1
31830252,SSIPe: accurately estimating protein-protein binding affinity change upon mutations using evolutionary profiles in combination with an optimized physical energy function.,ssipe,Uses resource as analysis tool,using_with,1
25664462,HPOSim: an R package for phenotypic similarity measure and enrichment analysis based on the human phenotype ontology.,hposim,Describes method/approach based on resource data,based_approach,1
26333163,Classification of Amino Acid Substitutions in Mismatch Repair Proteins Using PON-MMR2.,pon-mmr2,Uses resource as analysis tool,using_with,1
31161212,RNA-align: quick and accurate alignment of RNA 3D structures based on size-independent TM-scoreRNA.,,Describes method/approach based on resource data,based_approach,1
28969593,BioCarian: search engine for exploratory searches in heterogeneous biological databases.,,Data mining/querying of existing resource,mining_data,1
21602921,Gitools: analysis and visualisation of genomic data using interactive heat-maps.,,Uses resource as analysis tool,using_with,1
27078110,"Immuno-Navigator, a batch-corrected coexpression database, reveals cell type-specific gene networks in the immune system.",,Uses resource as analysis tool,reveals_identifies,1
25063298,The multiMiR R package and database: integration of microRNA-target interactions along with their disease and drug associations.,,Uses resource as analysis tool,using_with,1
22434837,AntiFam: a tool to help identify spurious ORFs in protein annotation.,,Uses resource as analysis tool,reveals_identifies,1
29554289,GenomeDISCO: a concordance score for chromosome conformation capture experiments using random walks on contact map graphs.,,Uses resource as analysis tool,using_with,1
30869596,Cross-Platform Ubiquitous Volume Rendering Using Programmable Shaders in VTK for Scientific and Medical Visualization.,vtk,Uses resource as analysis tool,using_with,1
25584184,AISO: Annotation of Image Segments with Ontologies.,aiso,Uses resource as analysis tool,using_with,1
28636001,WatAA: Atlas of Protein Hydration. Exploring synergies between data mining and ab initio calculations.,wataa,Data mining/querying of existing resource,mining_data,1
23530580,TPMS: a set of utilities for querying collections of gene trees.,tpms,Data mining/querying of existing resource,mining_data,1
31581246,"KETOS: Clinical decision support and machine learning as a service - A training and deployment platform based on Docker, OMOP-CDM, and FHIR Web Services.",ketos,Describes method/approach based on resource data,based_approach,1
25414339,CFam: a chemical families database based on iterative selection of functional seeds and seed-directed compound clustering.,cfam,Describes method/approach based on resource data,based_approach,1
29186338,Cpf1-Database: web-based genome-wide guide RNA library design for gene knockout screens using CRISPR-Cpf1.,,Uses resource as analysis tool,using_with,1
32588040,mAML: an automated machine learning pipeline with a microbiome repository for human disease classification.,maml,Uses resource as analysis tool,using_with,1
34208327,"Deep-Framework: A Distributed, Scalable, and Edge-Oriented Framework for Real-Time Analysis of Video Streams.",,Focuses on analysis/study using data from resource,analysis_study,1
27756204,RNAdualPF: software to compute the dual partition function with sample applications in molecular evolution theory.,,Uses resource as analysis tool,using_with,1
31799600,LARMD: integration of bioinformatic resources to profile ligand-driven protein dynamics with a case on the activation of estrogen receptor.,larmd,Uses resource as analysis tool,using_with,1
21624888,"SwissDock, a protein-small molecule docking web service based on EADock DSS.",,Describes method/approach based on resource data,based_approach,1
25349885,SeqAssist: a novel toolkit for preliminary analysis of next-generation sequencing data.,,Focuses on analysis/study using data from resource,analysis_study,1
24330401,iMir: an integrated pipeline for high-throughput analysis of small non-coding RNA data obtained by smallRNA-Seq.,imir,Focuses on analysis/study using data from resource,analysis_study,1
31779604,AMON: annotation of metabolite origins via networks to integrate microbiome and metabolome data.,amon,Uses resource as analysis tool,using_with,1
23023984,InterMine: a flexible data warehouse system for the integration and analysis of heterogeneous biological data.,,Focuses on analysis/study using data from resource,analysis_study,1
30124998,SLING: a tool to search for linked genes in bacterial datasets.,sling,Data mining/querying of existing resource,mining_data,1
30032202,TreeGrafter: phylogenetic tree-based annotation of proteins with Gene Ontology terms and other annotations.,,Uses resource as analysis tool,using_with,1
22480257,VESPA: software to facilitate genomic annotation of prokaryotic organisms through integration of proteomic and transcriptomic data.,vespa,Uses resource as analysis tool,using_with,1
31893451,Machine Learning-Based Annotation of Long Noncoding RNAs Using PLncPRO.,,Uses resource as analysis tool,using_with,1
34048546,BENviewer: a gene interaction network visualization server based on graph embedding model.,,Describes method/approach based on resource data,based_approach,1
30649350,Xolik: finding cross-linked peptides with maximum paired scores in linear time.,xolik,Uses resource as analysis tool,using_with,1
34316704,Cancer LncRNA Census 2 (CLC2): an enhanced resource reveals clinical features of cancer lncRNAs.,clc2,Uses resource as analysis tool,reveals_identifies,1
32212690,ChemSchematicResolver: A Toolkit to Decode 2D Chemical Diagrams with Labels and R-Groups into Annotated Chemical Named Entities.,,Uses resource as analysis tool,using_with,1
32491943,"FakeNewsNet: A Data Repository with News Content, Social Context, and Spatiotemporal Information for Studying Fake News on Social Media.",,Uses resource as analysis tool,using_with,1
30229363,ImFEATbox: a toolbox for extraction and analysis of medical image features.,,Focuses on analysis/study using data from resource,analysis_study,1
24037212,CruzDB: software for annotation of genomic intervals with UCSC genome-browser database.,cruzdb,Uses resource as analysis tool,using_with,1
24311580,LigSearch: a knowledge-based web server to identify likely ligands for a protein target.,,Uses resource as analysis tool,reveals_identifies,1
29657302,miRNAtools: Advanced Training Using the miRNA Web of Knowledge.,,Uses resource as analysis tool,using_with,1
29186292,SATORI: a system for ontology-guided visual exploration of biomedical data repositories.,satori,Data mining/querying of existing resource,mining_data,1
25580689,"The Lectin Frontier Database (LfDB), and data generation based on frontal affinity chromatography.",lfdb,Describes method/approach based on resource data,based_approach,1
27114494,CoReCG: a comprehensive database of genes associated with colon-rectal cancer.,corecg,Uses resource as analysis tool,using_with,1
32701164,WellExplorer: an integrative resource linking hydraulic fracturing chemicals with hormonal pathways and geographic location.,,Uses resource as analysis tool,using_with,1
32510568,CCLA: an accurate method and web server for cancer cell line authentication using gene expression profiles.,ccla,Uses resource as analysis tool,using_with,1
24573480,Prediction of intrinsic disorder in proteins using MFDp2.,mfdp2,Uses resource as analysis tool,using_with,1
34625425,"The Mutational Signature Comprehensive Analysis Toolkit (musicatk) for the Discovery, Prediction, and Exploration of Mutational Signatures.",,Data mining/querying of existing resource,mining_data,1
30445432,gmRAD: an integrated SNP calling pipeline for genetic mapping with RADseq across a hybrid population.,gmrad,Uses resource as analysis tool,using_with,1
27522608,HOMCOS: an updated server to search and model complex 3D structures.,homcos,Data mining/querying of existing resource,mining_data,1
26775705,CSGene: a literature-based database for cell senescence genes and its application to identify critical cell aging pathways and associated diseases.,csgene,Uses resource as analysis tool,reveals_identifies,1
30343671,PoSE: visualization of patterns of sequence evolution using PAML and MATLAB.,pose,Uses resource as analysis tool,using_with,1
27802571,Aquerium: A web application for comparative exploration of domain-based protein occurrences on the taxonomically clustered genome tree.,,Data mining/querying of existing resource,mining_data,1
23375020,FANTOM: Functional and taxonomic analysis of metagenomes.,fantom,Focuses on analysis/study using data from resource,analysis_study,1
30986215,GOOGA: A platform to synthesize mapping experiments and identify genomic structural diversity.,googa,Uses resource as analysis tool,reveals_identifies,1
28916823,Digging into the low molecular weight peptidome with the OligoNet web server.,,Uses resource as analysis tool,using_with,1
28362877,ARACHNE: A neural-neuroglial network builder with remotely controlled parallel computing.,arachne,Uses resource as analysis tool,using_with,1
34882760,OCTAVA: An open-source toolbox for quantitative analysis of optical coherence tomography angiography images.,octava,Focuses on analysis/study using data from resource,analysis_study,1
25886982,"GREGOR: evaluating global enrichment of trait-associated variants in epigenomic features using a systematic, data-driven approach.",gregor,Uses resource as analysis tool,using_with,1
33876217,CanDriS: posterior profiling of cancer-driving sites based on two-component evolutionary model.,,Describes method/approach based on resource data,based_approach,1
26139635,LDlink: a web-based application for exploring population-specific haplotype structure and linking correlated alleles of possible functional variants.,ldlink,Data mining/querying of existing resource,mining_data,1
21622954,Swimming into peptidomimetic chemical space using pepMMsMIMIC.,,Uses resource as analysis tool,using_with,1
27153714,"NSimScan: DNA comparison tool with increased speed, sensitivity and accuracy.",,Uses resource as analysis tool,using_with,1
21976864,VSDK: Virtual screening of small molecules using AutoDock Vina on Windows platform.,vsdk,Uses resource as analysis tool,using_with,1
30576492,Accelerating annotation of articles via automated approaches: evaluation of the neXtA5 curation-support tool by neXtProt.,nexta5,Uses resource as analysis tool,using_with,1
23620293,DIALIGN at GOBICS--multiple sequence alignment using various sources of external information.,dialign,Uses resource as analysis tool,using_with,1
25977292,BCSearch: fast structural fragment mining over large collections of protein structures.,,Data mining/querying of existing resource,mining_data,1
29057658,PhoStar: Identifying Tandem Mass Spectra of Phosphorylated Peptides before Database Search.,,Uses resource as analysis tool,reveals_identifies,1
30219850,"BhGLM: Bayesian hierarchical GLMs and survival models, with applications to genomics and epidemiology.",bhglm,Uses resource as analysis tool,using_with,1
23729471,BeEP Server: Using evolutionary information for quality assessment of protein structure models.,beep,Uses resource as analysis tool,using_with,1
33126862,"NBZIMM: negative binomial and zero-inflated mixed models, with application to microbiome/metagenomics data analysis.",nbzimm,Uses resource as analysis tool,using_with,1
22693219,GeneView: a comprehensive semantic search engine for PubMed.,,Data mining/querying of existing resource,mining_data,1
